RAX, Rackspace Hosting Inc., NYQ, n/a, USA
HR, Healthcare Realty Trust Incorporated, NYQ, REIT - Healthcare Facilities, USA
HST, Host Hotels & Resorts Inc., NYQ, REIT - Hotel/Motel, USA
HCA, HCA Healthcare Inc., NYQ, Hospitals, USA
WGL, WGL Holdings Inc., NYQ, Gas Utilities, USA
Q, Quintiles IMS Holdings Inc., NYQ, Medical Laboratories & Research, USA
WCG, WellCare Health Plans Inc., NYQ, Health Care Plans, USA
PTX, Pernix Therapeutics Holdings Inc., NGM, Drug Manufacturers, USA
HLT, Hilton Worldwide Holdings Inc., NYQ, Lodging, USA
SFUN, Fang Holdings Limited, NYQ, Internet Information Providers, USA
RDUS, Radius Health Inc., NGM, Biotechnology, USA
HCLP, Hi-Crush Partners LP, NYQ, Industrial Metals & Minerals, USA
MOH, Molina Healthcare Inc., NYQ, Health Care Plans, USA
HBI, Hanesbrands Inc., NYQ, Textile - Apparel Clothing, USA
SLCA, U.S. Silica Holdings Inc., NYQ, Industrial Metals & Minerals, USA
HYH, Halyard Health Inc., NYQ, Medical Instruments & Supplies, USA
HOS, Hornbeck Offshore Services Inc., NYQ, Oil & Gas Equipment & Services, USA
RNR, RenaissanceRe Holdings Ltd., NYQ, Property & Casualty Insurance, USA
LDOS, Leidos Holdings Inc., NYQ, Information & Delivery Services, USA
HNSN, Hansen Medical Inc., NGM, n/a, USA
HTH, Hilltop Holdings Inc., NYQ, Mortgage Investment, USA
LQ, La Quinta Holdings Inc., NYQ, Resorts & Casinos, USA
JHX, James Hardie Industries plc, NYQ, Cement, USA
HERO, Hercules Offshore Inc., NGM, n/a, USA
ST, Sensata Technologies Holding N.V., NYQ, Scientific & Technical Instruments, USA
ONVO, Organovo Holdings Inc., NGM, n/a, USA
NM, Navios Maritime Holdings Inc., NYQ, Shipping, USA
NHI, National Health Investors Inc., NYQ, REIT - Healthcare Facilities, USA
JHI, John Hancock Investors Trust, NYQ, n/a, USA
HGG, hhgregg Inc., NYQ, n/a, USA
NSM, Nationstar Mortgage Holdings Inc., NYQ, Mortgage Investment, USA
KND, Kindred Healthcare Inc., NYQ, Long-Term Care Facilities, USA
ITUB, Itaú Unibanco Holding S.A., NYQ, Foreign Regional Banks, USA
HZO, MarineMax Inc., NYQ, Specialty Retail, USA
HPY, Heartland Payment Systems Inc., NYQ, n/a, USA
UVE, Universal Insurance Holdings Inc., NYQ, Property & Casualty Insurance, USA
RHP, Ryman Hospitality Properties Inc., NYQ, REIT - Hotel/Motel, USA
PRO, PROS Holdings Inc., NYQ, Application Software, USA
MHO, M/I Homes Inc., NYQ, Residential Construction, USA
KCG, KCG Holdings Inc., NYQ, n/a, USA
HPP, Hudson Pacific Properties Inc., NYQ, REIT - Office, USA
HNR, Harvest Natural Resources Inc., NYQ, n/a, USA
TRQ, Turquoise Hill Resources Ltd., NYQ, Industrial Metals & Minerals, USA
ONE, Higher One Holdings Inc., NYQ, n/a, USA
NOAH, Noah Holdings Limited, NYQ, Asset Management, USA
NMR, Nomura Holdings Inc., NYQ, Investment Brokerage - National, USA
NLSN, Nielsen Holdings plc, NYQ, Information & Delivery Services, USA
HNP, Huaneng Power International Inc., NYQ, Electric Utilities, USA
HIL, Hill International Inc., NYQ, Management Services, USA
HI, Hillenbrand Inc., NYQ, Diversified Machinery, USA
WBC, WABCO Holdings Inc., NYQ, Auto Parts, USA
UHS, Universal Health Services Inc., NYQ, Hospitals, USA
TMH, Team Health Holdings Inc., NYQ, n/a, USA
SNOW, Intrawest Resorts Holdings Inc., NYQ, n/a, USA
RMAX, RE/MAX Holdings Inc., NYQ, Property Management, USA
MDC, M.D.C. Holdings Inc., NYQ, Residential Construction, USA
LHO, LaSalle Hotel Properties, NYQ, REIT - Hotel/Motel, USA
KW, Kennedy-Wilson Holdings Inc., NYQ, Property Management, USA
HII, Huntington Ingalls Industries Inc., NYQ, Aerospace/Defense Products & Services, USA
HABT, The Habit Restaurants Inc., NGM, Restaurants, USA
VR, Validus Holdings Ltd., NYQ, Property & Casualty Insurance, USA
LXFT, Luxoft Holding Inc., NYQ, Application Software, USA
KOP, Koppers Holdings Inc., NYQ, Specialty Chemicals, USA
JMEI, Jumei International Holding Limited, NYQ, Specialty Retail, USA
IL, IntraLinks Holdings Inc., NYQ, n/a, USA
HIW, Highwoods Properties Inc., NYQ, REIT - Office, USA
HGT, Hugoton Royalty Trust, NYQ, Oil & Gas Drilling & Exploration, USA
HF, HFF Inc., NYQ, Property Management, USA
OPY, Oppenheimer Holdings Inc., NYQ, Investment Brokerage - Regional, USA
INXN, InterXion Holding N.V., NYQ, Internet Software & Services, USA
INN, Summit Hotel Properties Inc., NYQ, Real Estate Development, USA
HT, Hersha Hospitality Trust, NYQ, REIT - Hotel/Motel, USA
HPJ, Highpower International Inc., NGM, Industrial Electrical Equipment, USA
HHS, Harte Hanks Inc., NYQ, Marketing Services, USA
RICK, RCI Hospitality Holdings Inc., NGM, Restaurants, USA
LXFR, Luxfer Holdings PLC, NYQ, Diversified Machinery, USA
HRC, Hill-Rom Holdings Inc., NYQ, Medical Instruments & Supplies, USA
HIIQ, Health Insurance Innovations Inc., NGM, Health Care Plans, USA
UHT, Universal Health Realty Income Trust, NYQ, REIT - Healthcare Facilities, USA
PEB, Pebblebrook Hotel Trust, NYQ, REIT - Hotel/Motel, USA
MCFT, MCBC Holdings Inc., NGM, Recreational Vehicles, USA
IMS, IMS Health Holdings Inc., NYQ, n/a, USA
HUBS, HubSpot Inc., NYQ, Application Software, USA
XHR, Xenia Hotels & Resorts Inc., NYQ, REIT - Hotel/Motel, USA
WLH, William Lyon Homes, NYQ, n/a, USA
VBTX, Veritex Holdings Inc., NGM, Regional - Southwest Banks, USA
QTWO, Q2 Holdings Inc., NYQ, Business Software & Services, USA
QCRH, QCR Holdings Inc., NGM, Regional - Southwest Banks, USA
PHT, Pioneer High Income Trust, NYQ, n/a, USA
LEJU, Leju Holdings Limited, NYQ, Property Management, USA
HY, Hyster-Yale Materials Handling Inc., NYQ, Trucks & Other Vehicles, USA
HQH, Tekla Healthcare Investors, NYQ, n/a, USA
SHO, Sunstone Hotel Investors Inc., NYQ, REIT - Hotel/Motel, USA
NMIH, NMI Holdings Inc., NGM, Surety & Title Insurance, USA
LNTH, Lantheus Holdings Inc., NGM, n/a, USA
HLI, Houlihan Lokey Inc., NYQ, Investment Brokerage - National, USA
SPLP, Steel Partners Holdings L.P., NYQ, Conglomerates, USA
KEN, Kenon Holdings Ltd., NYQ, n/a, USA
HSEB, HSBC Holdings plc, NYQ, n/a, USA
HRTG, Heritage Insurance Holdings Inc., NYQ, Property & Casualty Insurance, USA
HQL, Tekla Life Sciences Investors, NYQ, n/a, USA
HIFR, InfraREIT Inc., NYQ, n/a, USA
TUMI, Tumi Holdings Inc., NYQ, n/a, USA
TAOM, Taomee Holdings Ltd., NYQ, n/a, USA
NVGS, Navigator Holdings Ltd., NYQ, Shipping, USA
JP, Jupai Holdings Limited, NYQ, n/a, USA
HUBB, Hubbell Incorporated, NYQ, Diversified Electronics, USA
HCHC, HC2 Holdings Inc., NYQ, Long Distance Carriers, USA
NWHM, The New Home Company Inc., NYQ, Residential Construction, USA
JHS, John Hancock Income Securities Trust, NYQ, n/a, USA
ISTR, Investar Holding Corporation, NGM, Regional - Southwest Banks, USA
HTGX, Hercules Capital Inc., NYQ, n/a, USA
HMLP, Höegh LNG Partners LP, NYQ, Shipping, USA
CRBP, Corbus Pharmaceuticals Holdings Inc., NGM, Biotechnology, USA
CHCT, Community Healthcare Trust Incorporated, NYQ, n/a, USA
SPPRP, Supertel Hospitality Inc., NGM, n/a, USA
SOHO, Sotherly Hotels Inc., NGM, REIT - Hotel/Motel, USA
PIH, 1347 Property Insurance Holdings Inc., NGM, Property & Casualty Insurance, USA
INNL, Innocoll Holdings plc, NGM, n/a, USA
HVB, Hudson Valley Holding Corp., NYQ, n/a, USA
CYHHZ, Community Health Systems Inc., NGM, n/a, USA
CCZ, Comcast Holdings Corp., NYQ, n/a, USA
SOHOL, Sotherly Hotels LP - 8.00% Seni, NGM, n/a, USA
SNHN, Senior Housing Properties Trust, NYQ, n/a, USA
OMF, OneMain Holdings Inc., NYQ, n/a, USA
MHI, Pioneer Municipal High Income Trust, NYQ, n/a, USA
HBM, Hudbay Minerals Inc., NYQ, Industrial Metals & Minerals, USA
CMU, MFS High Yield Municipal Trust, NYQ, n/a, USA
CDORO, Condor Hospitality Trust Inc., NGM, n/a, USA
VLT, Invesco High Income Trust II, NYQ, n/a, USA
SPPRO, Supertel Hospitality Inc., NGM, n/a, USA
HSEA, HSBC Holdings plc, NYQ, n/a, USA
HCAPL, Harvest Capital Credit Corporation, NGM, n/a, USA
SOHOM, Sotherly Hotels LP, NGM, n/a, USA
HTGY, Hercules Capital Inc., NYQ, n/a, USA
CDORP, Condor Hospitality Trust Inc., NGM, n/a, USA
SNHO, Senior Housing Properties Trust, NYQ, n/a, USA
NM-PH, Navios Maritime Holdings Inc., NYQ, n/a, USA
HUSI-PF, HSBC USA Inc. Preferred Series, NYQ, n/a, USA
HEI-A, HEICO Corporation, NYQ, Aerospace/Defense Products & Services, USA
SHO-PE, Sunstone Hotel Investors Inc., NYQ, n/a, USA
MHO-PA, M/I Homes Inc., NYQ, n/a, USA
KWN, Kennedy-Wilson Holdings Inc., NYQ, n/a, USA
RNR-PE, RenaissanceRe Holdings Ltd., NYQ, n/a, USA
RNR-PC, RenaissanceRe Holdings Ltd., NYQ, n/a, USA
NMK-PB, Niagara Mohawk Power Corporation, NYQ, n/a, USA
NM-PG, Navios Maritime Holdings Inc., NYQ, n/a, USA
MRH-PA, Montpelier RE Holdings Ltd Non, NYQ, n/a, USA
LHO-PI, LaSalle Hotel Properties, NYQ, n/a, USA
INN-PB, Summit Hotel Properties Inc., NYQ, n/a, USA
HPT-PD, Hospitality Properties Trust Pr, NYQ, n/a, USA
HCN-PJ, Welltower Inc., NYQ, n/a, USA
HCN-PI, Welltower Inc., NYQ, n/a, USA
GRX-PA, The Gabelli Healthcare & Wellness Trust, NYQ, n/a, USA
AXS-PC, Axis Capital Holdings Limited P, NYQ, n/a, USA
AMH-PA, American Homes 4 Rent, NYQ, n/a, USA
AHL-PC, Aspen Insurance Holdings Limited, NYQ, n/a, USA
AHL-PB, Aspen Insurance Holdings Limite, NYQ, n/a, USA
SHO-PD, Sunstone Hotel Investors Inc., NYQ, n/a, USA
WMT, Wal-Mart Stores Inc., NYQ, Discount & Variety Stores, USA
SUNE, SunEdison Inc., NYQ, n/a, USA
VRX, Valeant Pharmaceuticals International Inc., NYQ, Drug Delivery, USA
PFE, Pfizer Inc., NYQ, Drug Manufacturers - Major, USA
NKE, NIKE Inc., NYQ, Textile - Apparel Footwear & Accessories, USA
PEP, Pepsico Inc., NYQ, Beverages - Soft Drinks, USA
TWTR, Twitter Inc., NYQ, Internet Information Providers, USA
PM, Philip Morris International Inc., NYQ, Cigarettes, USA
V, Visa Inc., NYQ, Credit Services, USA
TWX, Time Warner Inc., NYQ, Entertainment - Diversified, USA
KMI, Kinder Morgan Inc., NYQ, Oil & Gas Pipelines, USA
UPS, United Parcel Service Inc., NYQ, Air Delivery & Freight Services, USA
M, Macy's Inc., NYQ, Department Stores, USA
MET, MetLife Inc., NYQ, Life Insurance, USA
MA, Mastercard Incorporated, NYQ, Credit Services, USA
P, Pandora Media Inc., NYQ, Broadcasting - Radio, USA
JNPR, Juniper Networks Inc., NYQ, Networking & Communication Devices, USA
NOV, National Oilwell Varco Inc., NYQ, Oil & Gas Equipment & Services, USA
YOKU, Youku Tudou Inc., NYQ, n/a, USA
TEVA, Teva Pharmaceutical Industries Limited, NYQ, Drug Manufacturers, USA
MSI, Motorola Solutions Inc., NYQ, Communication Equipment, USA
TYC, Tyco International plc, NYQ, n/a, USA
WTW, Weight Watchers International Inc., NYQ, Personal Services, USA
SKX, Skechers U.S.A. Inc., NYQ, Textile - Apparel Footwear & Accessories, USA
SHAK, Shake Shack Inc., NYQ, Specialty Eateries, USA
PPG, PPG Industries Inc., NYQ, Specialty Chemicals, USA
VMW, VMware Inc., NYQ, Technical & System Software, USA
VTR, Ventas Inc., NYQ, REIT - Healthcare Facilities, USA
TER, Teradyne Inc., NYQ, Semiconductor Equipment & Materials, USA
YELP, Yelp Inc., NYQ, Internet Information Providers, USA
WM, Waste Management Inc., NYQ, Waste Management, USA
JWN, Nordstrom Inc., NYQ, Apparel Stores, USA
ITW, Illinois Tool Works Inc., NYQ, Diversified Machinery, USA
MGM, MGM Resorts International, NYQ, Resorts & Casinos, USA
WSO, Watsco Inc., NYQ, Electronics Wholesale, USA
TRN, Trinity Industries Inc., NYQ, Railroads, USA
NI, NiSource Inc., NYQ, Diversified Utilities, USA
MLM, Martin Marietta Materials Inc., NYQ, General Building Materials, USA
R, Ryder System Inc., NYQ, Rental & Leasing Services, USA
PX, Praxair Inc., NYQ, Chemicals - Major Diversified, USA
LXK, Lexmark International Inc., NYQ, n/a, USA
INFY, Infosys Limited, NYQ, Technical & System Software, USA
WDAY, Workday Inc., NYQ, Application Software, USA
MXL, MaxLinear Inc., NYQ, Semiconductor - Integrated Circuits, USA
RSG, Republic Services Inc., NYQ, Waste Management, USA
MWW, Monster Worldwide Inc., NYQ, n/a, USA
LEG, Leggett & Platt Incorporated, NYQ, Home Furnishings & Fixtures, USA
URI, United Rentals Inc., NYQ, Rental & Leasing Services, USA
OVAS, OvaScience Inc., NGM, Biotechnology, USA
NBR, Nabors Industries Ltd., NYQ, Oil & Gas Drilling & Exploration, USA
IR, Ingersoll-Rand Plc, NYQ, Diversified Machinery, USA
WFT, Weatherford International plc, NYQ, Oil & Gas Equipment & Services, USA
TSS, Total System Services Inc., NYQ, Credit Services, USA
PHM, PulteGroup Inc., NYQ, Residential Construction, USA
WUBA, 58.com Inc., NYQ, Internet Information Providers, USA
PSTG, Pure Storage Inc., NYQ, n/a, USA
MAN, ManpowerGroup Inc., NYQ, Staffing & Outsourcing Services, USA
LTC, LTC Properties Inc., NYQ, REIT - Healthcare Facilities, USA
SNA, Snap-on Incorporated, NYQ, Small Tools & Accessories, USA
RYN, Rayonier Inc., NYQ, Lumber & Wood Production, USA
IRM, Iron Mountain Incorporated, NYQ, Business Software & Services, USA
SQ, Square Inc., NYQ, n/a, USA
LM, Legg Mason Inc., NYQ, Asset Management, USA
INVN, InvenSense Inc., NYQ, n/a, USA
ZTS, Zoetis Inc., NYQ, Drugs - Generic, USA
WSM, Williams-Sonoma Inc., NYQ, Home Furnishing Stores, USA
RES, RPC Inc., NYQ, Oil & Gas Equipment & Services, USA
PII, Polaris Industries Inc., NYQ, Recreational Vehicles, USA
OKE, ONEOK Inc., NYQ, Gas Utilities, USA
OAS, Oasis Petroleum Inc., NYQ, Independent Oil & Gas, USA
VAR, Varian Medical Systems Inc., NYQ, Medical Appliances & Equipment, USA
TDW, Tidewater Inc., NYQ, Oil & Gas Equipment & Services, USA
STWD, Starwood Property Trust Inc., NYQ, REIT - Diversified, USA
PWR, Quanta Services Inc., NYQ, General Contractors, USA
LGND, Ligand Pharmaceuticals Incorporated, NGM, Biotechnology, USA
IM, Ingram Micro Inc., NYQ, n/a, USA
XPO, XPO Logistics Inc., NYQ, Air Delivery & Freight Services, USA
NNN, National Retail Properties Inc., NYQ, REIT - Diversified, USA
MUSA, Murphy USA Inc., NYQ, Specialty Retail, USA
IVZ, Invesco Ltd., NYQ, Asset Management, USA
WGO, Winnebago Industries Inc., NYQ, Recreational Vehicles, USA
STAG, STAG Industrial Inc., NYQ, REIT - Industrial, USA
RPM, RPM International Inc., NYQ, Specialty Chemicals, USA
OMI, Owens & Minor Inc., NYQ, Medical Equipment Wholesale, USA
WST, West Pharmaceutical Services Inc., NYQ, Medical Instruments & Supplies, USA
SVU, SUPERVALU Inc., NYQ, Grocery Stores, USA
OI, Owens-Illinois Inc., NYQ, Packaging & Containers, USA
MHK, Mohawk Industries Inc., NYQ, Home Furnishings & Fixtures, USA
JLL, Jones Lang LaSalle Incorporated, NYQ, Property Management, USA
ZGNX, Zogenix Inc., NGM, Drug Manufacturers - Major, USA
WNR, Western Refining Inc., NYQ, n/a, USA
RENN, Renren Inc., NYQ, Internet Software & Services, USA
TXT, Textron Inc., NYQ, Aerospace/Defense - Major Diversified, USA
OII, Oceaneering International Inc., NYQ, Oil & Gas Equipment & Services, USA
NWL, Newell Brands Inc., NYQ, Housewares & Accessories, USA
NVLS, Nivalis Therapeutics Inc., NGM, n/a, USA
LYB, LyondellBasell Industries N.V., NYQ, Specialty Chemicals, USA
TFX, Teleflex Incorporated, NYQ, Medical Instruments & Supplies, USA
SCMP, Sucampo Pharmaceuticals Inc., NGM, Drug Manufacturers, USA
RT, Ruby Tuesday Inc., NYQ, Restaurants, USA
LII, Lennox International Inc., NYQ, Diversified Machinery, USA
TAHO, Tahoe Resources Inc., NYQ, Industrial Metals & Minerals, USA
RSE, Rouse Properties Inc., NYQ, n/a, USA
PKI, PerkinElmer Inc., NYQ, Medical Laboratories & Research, USA
PAY, VeriFone Systems Inc., NYQ, Business Equipment, USA
NSR, NeuStar Inc., NYQ, n/a, USA
NQ, NQ Mobile Inc., NYQ, Application Software, USA
KBR, KBR Inc., NYQ, Technical Services, USA
VSLR, Vivint Solar Inc., NYQ, Semiconductor - Specialized, USA
RRTS, Roadrunner Transportation Systems Inc., NYQ, Air Delivery & Freight Services, USA
RKUS, Ruckus Wireless Inc., NYQ, n/a, USA
NOW, ServiceNow Inc., NYQ, Information Technology Services, USA
MMS, MAXIMUS Inc., NYQ, Business Services, USA
WAGE, WageWorks Inc., NYQ, Management Services, USA
VNTV, Vantiv Inc., NYQ, Business Services, USA
TWI, Titan International Inc., NYQ, Farm & Construction Machinery, USA
TGNA, TEGNA Inc., NYQ, Broadcasting - TV, USA
SUP, Superior Industries International Inc., NYQ, Auto Parts, USA
PFPT, Proofpoint Inc., NGM, Application Software, USA
MTZ, MasTec Inc., NYQ, Heavy Construction, USA
MSCI, MSCI Inc., NYQ, Processing Systems & Products, USA
MPW, Medical Properties Trust Inc., NYQ, REIT - Healthcare Facilities, USA
MDR, McDermott International Inc., NYQ, Oil & Gas Equipment & Services, USA
LAD, Lithia Motors Inc., NYQ, Auto Dealerships, USA
VMI, Valmont Industries Inc., NYQ, Metal Fabrication, USA
TDY, Teledyne Technologies Incorporated, NYQ, Scientific & Technical Instruments, USA
ROL, Rollins Inc., NYQ, Business Services, USA
RMTI, Rockwell Medical Inc., NGM, Drug Manufacturers - Major, USA
PRLB, Proto Labs Inc., NYQ, Machine Tools & Accessories, USA
PMT, PennyMac Mortgage Investment Trust, NYQ, REIT - Diversified, USA
PLD, Prologis Inc., NYQ, REIT - Industrial, USA
MUX, McEwen Mining Inc., NYQ, Industrial Metals & Minerals, USA
I, Intelsat S.A., NYQ, Diversified Communication Services, USA
YUME, YuMe Inc., NYQ, Advertising Agencies, USA
VER, VEREIT Inc., NYQ, n/a, USA
TYL, Tyler Technologies Inc., NYQ, Technical & System Software, USA
TBI, TrueBlue Inc., NYQ, Staffing & Outsourcing Services, USA
REV, Revlon Inc., NYQ, Personal Products, USA
POWR, PowerSecure International Inc., NYQ, n/a, USA
NXRT, NexPoint Residential Trust Inc., NYQ, n/a, USA
N, NetSuite Inc., NYQ, n/a, USA
INSY, INSYS Therapeutics Inc., NGM, Biotechnology, USA
IMMU, Immunomedics Inc., NGM, Biotechnology, USA
XYL, Xylem Inc., NYQ, Diversified Machinery, USA
UDR, UDR Inc., NYQ, REIT - Residential, USA
TSLX, TPG Specialty Lending Inc., NYQ, n/a, USA
TR, Tootsie Roll Industries Inc., NYQ, Confectioners, USA
RGLS, Regulus Therapeutics Inc., NGM, Biotechnology, USA
PIR, Pier 1 Imports Inc., NYQ, Specialty Retail, USA
MTN, Vail Resorts Inc., NYQ, Resorts & Casinos, USA
MACK, Merrimack Pharmaceuticals Inc., NGM, Biotechnology, USA
INGR, Ingredion Incorporated, NYQ, Processed & Packaged Goods, USA
TPX, Tempur Sealy International Inc., NYQ, Home Furnishings & Fixtures, USA
THO, Thor Industries Inc., NYQ, Recreational Vehicles, USA
SSNI, Silver Spring Networks Inc., NYQ, Computer Based Systems, USA
SDT, SandRidge Mississippian Trust I, NYQ, Independent Oil & Gas, USA
RWT, Redwood Trust Inc., NYQ, REIT - Diversified, USA
OXM, Oxford Industries Inc., NYQ, Textile - Apparel Clothing, USA
OSTK, Overstock.com Inc., NGM, Catalog & Mail Order Houses, USA
MWA, Mueller Water Products Inc., NYQ, Industrial Equipment & Components, USA
MMI, Marcus & Millichap Inc., NYQ, Real Estate Development, USA
LXU, LSB Industries Inc., NYQ, Chemicals - Major Diversified, USA
KRO, Kronos Worldwide Inc., NYQ, Specialty Chemicals, USA
ZSPH, ZS Pharma Inc., NGM, n/a, USA
ZOES, Zoe's Kitchen Inc., NYQ, Restaurants, USA
WWW, Wolverine World Wide Inc., NYQ, Textile - Apparel Footwear & Accessories, USA
WTI, W&T Offshore Inc., NYQ, Oil & Gas Drilling & Exploration, USA
WRI, Weingarten Realty Investors, NYQ, REIT - Retail, USA
VEEV, Veeva Systems Inc., NYQ, Healthcare Information Services, USA
UFI, Unifi Inc., NYQ, Textile Industrial, USA
SYNC, Synacor Inc., NGM, Internet Information Providers, USA
SWM, Schweitzer-Mauduit International Inc., NYQ, Paper & Paper Products, USA
STNG, Scorpio Tankers Inc., NYQ, Shipping, USA
RMD, ResMed Inc., NYQ, Medical Appliances & Equipment, USA
RFIL, RF Industries Ltd., NGM, n/a, USA
PPS, Post Properties Inc., NYQ, n/a, USA
NVR, NVR Inc., NYQ, Residential Construction, USA
NR, Newpark Resources Inc., NYQ, Oil & Gas Equipment & Services, USA
KEYS, Keysight Technologies Inc., NYQ, Scientific & Technical Instruments, USA
IPI, Intrepid Potash Inc., NYQ, AGricultural Chemicals, USA
WMK, Weis Markets Inc., NYQ, Grocery Stores, USA
WEX, WEX Inc., NYQ, Business Services, USA
W, Wayfair Inc., NYQ, Catalog & Mail Order Houses, USA
VNDA, Vanda Pharmaceuticals Inc., NGM, Biotechnology, USA
TTGT, TechTarget Inc., NGM, Internet Information Providers, USA
SYPR, Sypris Solutions Inc., NGM, Auto Parts, USA
ROP, Roper Technologies Inc., NYQ, Diversified Machinery, USA
RNG, RingCentral Inc., NYQ, Application Software, USA
PRCP, Perceptron Inc., NGM, Scientific & Technical Instruments, USA
PNM, PNM Resources Inc., NYQ, Diversified Utilities, USA
OMN, OMNOVA Solutions Inc., NYQ, Specialty Chemicals, USA
MYE, Myers Industries Inc., NYQ, Rubber & Plastics, USA
MVIS, MicroVision Inc., NGM, Diversified Electronics, USA
MTX, Minerals Technologies Inc., NYQ, Chemicals - Major Diversified, USA
MGA, Magna International Inc., NYQ, Auto Parts Wholesale, USA
LDR, Landauer Inc., NYQ, Scientific & Technical Instruments, USA
KNX, Knight Transportation Inc., NYQ, Trucking, USA
VEC, Vectrus Inc., NYQ, Business Services, USA
TACT, TransAct Technologies Incorporated, NGM, Computer Peripherals, USA
SUPN, Supernus Pharmaceuticals Inc., NGM, Drugs - Generic, USA
SSS, Sovran Self Storage Inc., NYQ, n/a, USA
QUAD, Quad/Graphics Inc., NYQ, Business Services, USA
PRI, Primerica Inc., NYQ, Life Insurance, USA
OFLX, Omega Flex Inc., NGM, Industrial Equipment & Components, USA
NP, Neenah Paper Inc., NYQ, Paper & Paper Products, USA
NNI, Nelnet Inc., NYQ, Credit Services, USA
NL, NL Industries Inc., NYQ, Industrial Equipment Wholesale, USA
MTD, Mettler-Toledo International Inc., NYQ, Medical Instruments & Supplies, USA
MATX, Matson Inc., NYQ, Shipping, USA
LOCK, LifeLock Inc., NYQ, n/a, USA
KNL, Knoll Inc., NYQ, Business Equipment, USA
XRM, Xerium Technologies Inc., NYQ, Diversified Machinery, USA
WTS, Watts Water Technologies Inc., NYQ, Industrial Equipment & Components, USA
TTI, TETRA Technologies Inc., NYQ, Oil & Gas Equipment & Services, USA
TRNS, Transcat Inc., NGM, Scientific & Technical Instruments, USA
TIER, TIER REIT Inc., NYQ, REIT - Office, USA
TI, Telecom Italia S.p.A., NYQ, Diversified Communication Services, USA
TEN, Tenneco Inc., NYQ, Auto Parts, USA
SSTK, Shutterstock Inc., NYQ, Business Services, USA
SSI, Stage Stores Inc., NYQ, Apparel Stores, USA
SRI, Stoneridge Inc., NYQ, Auto Parts, USA
SDR, Sandridge Mississippian Trust II, NYQ, Independent Oil & Gas, USA
SAGE, Sage Therapeutics Inc., NGM, Biotechnology, USA
OIS, Oil States International Inc., NYQ, Oil & Gas Equipment & Services, USA
OCUL, Ocular Therapeutix Inc., NGM, Biotechnology, USA
OCRX, Ocera Therapeutics Inc., NGM, Biotechnology, USA
NYLD, NRG Yield Inc., NYQ, Electric Utilities, USA
NLS, Nautilus Inc., NYQ, Sporting Goods, USA
MDGN, Aevi Genomic Medicine Inc., NGM, n/a, USA
LZB, La-Z-Boy Incorporated, NYQ, Home Furnishings & Fixtures, USA
LPI, Laredo Petroleum Inc., NYQ, Independent Oil & Gas, USA
JMBA, Jamba Inc., NGM, Restaurants, USA
IHS, IHS Inc., NYQ, n/a, USA
WOR, Worthington Industries Inc., NYQ, Steel & Iron, USA
UG, United-Guardian Inc., NGM, Personal Products, USA
TRK, Speedway Motorsports Inc., NYQ, Sporting Activities, USA
TOWR, Tower International Inc., NYQ, Auto Parts, USA
TDOC, Teladoc Inc., NYQ, Healthcare Information Services, USA
SRT, StarTek Inc., NYQ, Business Services, USA
RVNC, Revance Therapeutics Inc., NGM, Biotechnology, USA
RUBI, the Rubicon Project Inc., NYQ, Application Software, USA
RST, Rosetta Stone Inc., NYQ, Application Software, USA
REXR, Rexford Industrial Realty Inc., NYQ, REIT - Industrial, USA
RDNT, RadNet Inc., NGM, Medical Laboratories & Research, USA
QTS, QTS Realty Trust Inc., NYQ, REIT - Industrial, USA
PN, Patriot National Inc., NYQ, Insurance Brokers, USA
PLT, Plantronics Inc., NYQ, Processing Systems & Products, USA
ORA, Ormat Technologies Inc., NYQ, Electric Utilities, USA
NERV, Minerva Neurosciences Inc., NGM, Biotechnology, USA
MTOR, Meritor Inc., NYQ, Auto Parts, USA
MD, MEDNAX Inc., NYQ, Specialized Health Services, USA
LDL, Lydall Inc., NYQ, Auto Parts, USA
LAKE, Lakeland Industries Inc., NGM, Medical Instruments & Supplies, USA
VSTM, Verastem Inc., NGM, Biotechnology, USA
USPH, U.S. Physical Therapy Inc., NYQ, Specialized Health Services, USA
UPLD, Upland Software Inc., NGM, Application Software, USA
TLK, PT Telekomunikasi Indonesia Tbk, NYQ, Diversified Communication Services, USA
SCS, Steelcase Inc., NYQ, Business Equipment, USA
RSPP, RSP Permian Inc., NYQ, Oil & Gas Drilling & Exploration, USA
RIC, Richmont Mines Inc., NYQ, Gold, USA
RGCO, RGC Resources Inc., NGM, Gas Utilities, USA
PRTK, Paratek Pharmaceuticals Inc., NGM, Biotechnology, USA
PPT, Putnam Premier Income Trust, NYQ, n/a, USA
PAYC, Paycom Software Inc., NYQ, Application Software, USA
OLP, One Liberty Properties Inc., NYQ, REIT - Diversified, USA
NXP, Nuveen Select Tax-Free Income Portfolio, NYQ, n/a, USA
NTL, Nortel Inversora S.A., NYQ, Telecom Services - Foreign, USA
NPK, National Presto Industries Inc., NYQ, Aerospace/Defense Products & Services, USA
NMBL, Nimble Storage Inc., NYQ, n/a, USA
NC, NACCO Industries Inc., NYQ, Home Furnishings & Fixtures, USA
MFRI, Perma-Pipe International Holdings Inc., NGM, n/a, USA
MDLY, Medley Management Inc., NYQ, n/a, USA
MBI, MBIA Inc., NYQ, Property & Casualty Insurance, USA
KFY, Korn/Ferry International, NYQ, Staffing & Outsourcing Services, USA
KAI, Kadant Inc., NYQ, Diversified Machinery, USA
IRS, IRSA Inversiones y Representaciones Sociedad Anónima, NYQ, Real Estate Development, USA
IDA, IdaCorp Inc., NYQ, Electric Utilities, USA
ZEN, Zendesk Inc., NYQ, Application Software, USA
WCC, WESCO International Inc., NYQ, Industrial Equipment Wholesale, USA
VSI, Vitamin Shoppe Inc., NYQ, Specialty Retail, USA
JNJ, Johnson & Johnson, NYQ, Drug Manufacturers - Major, USA
SIG, Signet Jewelers Limited, NYQ, Jewelry Stores, USA
SJI, South Jersey Industries Inc., NYQ, Gas Utilities, USA
JCAP, Jernigan Capital Inc., NYQ, REIT - Industrial, USA
WOWO, JM WOWO, NGM, n/a, USA
LMHA, Legg Mason Inc., NYQ, n/a, USA
PFH, CABCO Trust for JC Penney Debentures, NYQ, n/a, USA
JW-B, John Wiley & Sons Inc., NYQ, n/a, USA
TMK-PB, Torchmark Corporation, NYQ, n/a, USA
JPM-WT, J P Morgan Chase & Co Warrant e, NYQ, n/a, USA
JPM-PCCL, JPM-PCCL, NYQ, n/a, USA
JSN, JSN, NYQ, n/a, USA
NEE-PI, NextEra Energy Capital Holdings Inc., NYQ, n/a, USA
JPZ, JPZ, NYQ, n/a, USA
KEY, KeyCorp, NYQ, Regional - Midwest Banks, USA
PHG, Koninklijke Philips N.V., NYQ, Electronic Equipment, USA
